{
  "schema": "nanollm.bench/v1",
  "consent_version": "2026-10",
  "suite": {
    "id": "dev",
    "version": "v1",
    "prompts_sha256": "ad01c12080c9d8d68bf3bd9414940694635d0fdf85c2539ffee4b127c7429754",
    "quick": true
  },
  "client": {
    "nanollm": "dev",
    "llama_cpp": {
      "tag": "b11600",
      "commit": "aad9f95e3ad7d397a4e54770d0e712ae281cd9af"
    },
    "ggml_cpu_variant": "haswell",
    "os": "linux",
    "arch": "amd64"
  },
  "model": {
    "id": "gemma-4-e4b-qat",
    "revision": "8c5a9e4fd5482e2be20fe0bf013b4c262a8f4265",
    "sha256": "df0fd4ee07072c607c29a0a1cb4f98918426cca12f45a2776bdd6ee6d09a4de3",
    "drafter_sha256": "423074e537504b4f9ec5eafed5c639fac82c96631626efccacdd3c4039b20605"
  },
  "machine": {
    "cpu": {
      "vendor": "AMD",
      "model": "AMD EPYC 7351P",
      "cores": 16,
      "threads": 32,
      "isa": [
        "avx",
        "avx2",
        "fma",
        "f16c"
      ]
    },
    "memory": {
      "total_bytes": 135036997632
    },
    "system": {
      "vendor": "To Be Filled By O.E.M.",
      "product": "To Be Filled By O.E.M.",
      "form_factor": "server",
      "chassis": "desktop"
    },
    "os": {
      "name": "ubuntu",
      "version": "26.04",
      "kernel_mm": "7.0"
    },
    "power": {},
    "disk": {
      "type": "hdd"
    },
    "extra": [
      {
        "key": "numa_nodes",
        "value": "4"
      },
      {
        "key": "governor",
        "value": "performance"
      },
      {
        "key": "boost",
        "value": "1"
      },
      {
        "key": "thp",
        "value": "madvise"
      },
      {
        "key": "numa_balancing",
        "value": "1"
      },
      {
        "key": "loadavg_1m",
        "value": "4.15"
      },
      {
        "key": "model_disk",
        "value": "md3"
      },
      {
        "key": "model_disk_rotational",
        "value": "1"
      },
      {
        "key": "model_read_ahead_kb",
        "value": "8192"
      },
      {
        "key": "model_max_sectors_kb",
        "value": "4096"
      }
    ]
  },
  "runs": [
    {
      "preset": "ram-8g",
      "plan_hash": "f294091f086c47e9",
      "plan": {
        "mode": "ram-full",
        "device": "llamacpp:cpu",
        "gpu_layers": 0,
        "n_ctx": 32768,
        "slots": 1,
        "kv": "f16",
        "fa": true,
        "swa_full": true,
        "mtp": true,
        "threads": 16,
        "enforcement": "strict",
        "threads_batch": 16,
        "n_batch": 2048,
        "n_ubatch": 512,
        "kv_v": "f16",
        "repack": "on",
        "load_mode": "dio",
        "lazy": "off",
        "draft_max": 3,
        "numa": "interleave",
        "cold": true
      },
      "metrics": {
        "load_ms": 56915.097,
        "pp_tok_s": 139.23448308489338,
        "tg_tok_s": {
          "d0": 24.699693089432
        },
        "ttft_ms": 454.715,
        "chat_tok_s": 23.955587285814474,
        "mtp": {
          "acceptance": 0.4444444444444444,
          "speedup": 1.1896753601872645,
          "tok_s": 28.499371932748787
        },
        "echo": {
          "acceptance": 1,
          "speedup": 1.9990176110282336,
          "tok_s": 46.68551576598265
        },
        "peak_rss": 6959448064,
        "peak_page_cache": 50339840,
        "peak_cgroup": 7000678400,
        "buffers": {
          "CPU": 2002947931,
          "CPU_REPACK": 2656053492
        },
        "stddev": {
          "chat_tok_s": 0.24481835489563325,
          "echo_draft_tok_s": 0.5535534935689145,
          "echo_tok_s": 0.14680824796019856,
          "mtp_tok_s": 0.24033817348426845,
          "pp_tok_s": 4.705347110146791,
          "tg_tok_s.d0": 0.46744804583055327,
          "ttft_ms": 31.10701658468716
        }
      },
      "reps": 5,
      "output": {
        "sha256": "fab7a62f8f866c6db18dbbb1df23b9990c154be774b76c3216b745dd57c83342",
        "tokens": 128
      },
      "status": "ok"
    }
  ],
  "date": "2026-10-20",
  "duration_s": 209.544307926
}
