{
  "schema": "nanollm.bench/v1",
  "consent_version": "2026-10",
  "suite": {
    "id": "dev",
    "version": "v1",
    "prompts_sha256": "ad01c12080c9d8d68bf3bd9414940694635d0fdf85c2539ffee4b127c7429754",
    "quick": true
  },
  "client": {
    "nanollm": "d6976bc-dirty",
    "llama_cpp": {
      "tag": "b11600",
      "commit": "ace20f679e30a39c09a7b17bec14199855469633"
    },
    "ggml_cpu_variant": "haswell",
    "os": "linux",
    "arch": "amd64"
  },
  "model": {
    "id": "gemma-4-e4b-qat",
    "revision": "8c5a9e4fd5482e2be20fe0bf013b4c262a8f4265",
    "sha256": "df0fd4ee07072c607c29a0a1cb4f98918426cca12f45a2776bdd6ee6d09a4de3",
    "drafter_sha256": "423074e537504b4f9ec5eafed5c639fac82c96631626efccacdd3c4039b20605"
  },
  "machine": {
    "cpu": {
      "vendor": "AMD",
      "model": "AMD EPYC 7351P",
      "cores": 16,
      "threads": 32,
      "isa": [
        "avx",
        "avx2",
        "fma",
        "f16c"
      ]
    },
    "memory": {
      "total_bytes": 135036997632
    },
    "system": {
      "vendor": "To Be Filled By O.E.M.",
      "product": "To Be Filled By O.E.M.",
      "form_factor": "server",
      "chassis": "desktop"
    },
    "os": {
      "name": "ubuntu",
      "version": "26.04",
      "kernel_mm": "7.0"
    },
    "power": {},
    "disk": {
      "type": "hdd"
    },
    "extra": [
      {
        "key": "numa_nodes",
        "value": "4"
      },
      {
        "key": "governor",
        "value": "performance"
      },
      {
        "key": "boost",
        "value": "1"
      },
      {
        "key": "thp",
        "value": "madvise"
      },
      {
        "key": "numa_balancing",
        "value": "1"
      },
      {
        "key": "loadavg_1m",
        "value": "14.81"
      }
    ]
  },
  "runs": [
    {
      "preset": "ram-8g",
      "plan_hash": "9a34c8e66fb5dcf9",
      "plan": {
        "mode": "ram-full",
        "device": "llamacpp:cpu",
        "gpu_layers": 0,
        "n_ctx": 32768,
        "slots": 1,
        "kv": "f16",
        "fa": true,
        "swa_full": true,
        "mtp": true,
        "threads": 4,
        "enforcement": "strict",
        "threads_batch": 4,
        "n_batch": 2048,
        "n_ubatch": 512,
        "kv_v": "f16",
        "repack": "on",
        "load_mode": "dio",
        "lazy": "off",
        "draft_max": 3,
        "numa": "node:0",
        "cpus": "0-3",
        "cold": true
      },
      "metrics": {
        "load_ms": 50343.413,
        "pp_tok_s": 13.455157345132037,
        "tg_tok_s": {
          "d0": 7.955364626470437
        },
        "ttft_ms": 4870.21,
        "chat_tok_s": 7.866641596047423,
        "mtp": {
          "acceptance": 0.4444444444444444,
          "speedup": 0.6783450624629624,
          "tok_s": 5.336297484844528
        },
        "peak_rss": 6975188992,
        "peak_page_cache": 50339840,
        "peak_cgroup": 7012155392,
        "buffers": {
          "CPU": 2002947931,
          "CPU_REPACK": 2656053492
        },
        "stddev": {
          "chat_tok_s": 0.01509067106857345,
          "mtp_tok_s": 0.011184851038302178,
          "pp_tok_s": 0.032538679030128914,
          "tg_tok_s.d0": 0.03578545128299332,
          "ttft_ms": 4.694547049503084
        }
      },
      "reps": 3,
      "output": {
        "sha256": "fab7a62f8f866c6db18dbbb1df23b9990c154be774b76c3216b745dd57c83342",
        "tokens": 128
      },
      "status": "ok"
    },
    {
      "preset": "ram-6g",
      "plan_hash": "303575a671609db2",
      "plan": {
        "mode": "ram-full",
        "device": "llamacpp:cpu",
        "gpu_layers": 0,
        "n_ctx": 16384,
        "slots": 1,
        "kv": "f16",
        "fa": true,
        "swa_full": true,
        "mtp": true,
        "threads": 4,
        "enforcement": "strict",
        "threads_batch": 4,
        "n_batch": 2048,
        "n_ubatch": 512,
        "kv_v": "f16",
        "repack": "on",
        "load_mode": "dio",
        "lazy": "off",
        "draft_max": 3,
        "numa": "node:0",
        "cpus": "0-3",
        "cold": true
      },
      "metrics": {
        "load_ms": 52382.739,
        "pp_tok_s": 13.55716329870971,
        "tg_tok_s": {
          "d0": 7.970867097840585
        },
        "ttft_ms": 4861.859,
        "chat_tok_s": 7.879966609995355,
        "mtp": {
          "acceptance": 0.4444444444444444,
          "speedup": 0.676241642808777,
          "tok_s": 5.328761565621568
        },
        "peak_rss": 6026711040,
        "peak_page_cache": 50339840,
        "peak_cgroup": 6061367296,
        "buffers": {
          "CPU": 2002947931,
          "CPU_REPACK": 2656053492
        },
        "stddev": {
          "chat_tok_s": 0.01834877680574843,
          "mtp_tok_s": 0.01273013476644685,
          "pp_tok_s": 0.005681016540190608,
          "tg_tok_s.d0": 0.0067675114370194436,
          "ttft_ms": 8.562872025981509
        }
      },
      "reps": 3,
      "output": {
        "sha256": "fab7a62f8f866c6db18dbbb1df23b9990c154be774b76c3216b745dd57c83342",
        "tokens": 128
      },
      "status": "ok"
    },
    {
      "preset": "ram-4g",
      "plan_hash": "286eb3bc528d72a2",
      "plan": {
        "mode": "ram-ple-disk",
        "device": "llamacpp:cpu",
        "gpu_layers": 0,
        "n_ctx": 8192,
        "slots": 1,
        "kv": "f16",
        "fa": true,
        "swa_full": true,
        "mtp": true,
        "threads": 4,
        "enforcement": "strict",
        "threads_batch": 4,
        "n_batch": 2048,
        "n_ubatch": 512,
        "kv_v": "f16",
        "repack": "on",
        "load_mode": "mmap",
        "lazy": "on",
        "draft_max": 3,
        "numa": "node:0",
        "cpus": "0-3",
        "cold": true
      },
      "metrics": {
        "load_ms": 22266.348,
        "pp_tok_s": 13.577304252165957,
        "tg_tok_s": {
          "d0": 7.976907001959134
        },
        "ttft_ms": 4860.271,
        "chat_tok_s": 7.897175621993296,
        "mtp": {
          "acceptance": 0.4444444444444444,
          "speedup": 0.6761242965087253,
          "tok_s": 5.339472311826072
        },
        "peak_rss": 4512444416,
        "peak_locked": 2932736,
        "peak_page_cache": 2209046528,
        "peak_cgroup": 4496297984,
        "buffers": {
          "CPU_Mapped": 2002895427,
          "CPU_REPACK": 2656053492
        },
        "stddev": {
          "chat_tok_s": 0.1856419421277294,
          "mtp_tok_s": 0.04659044691327253,
          "pp_tok_s": 0.1833450617416794,
          "tg_tok_s.d0": 0.4204830914348931,
          "ttft_ms": 184.14652891198733
        }
      },
      "reps": 3,
      "output": {
        "sha256": "fab7a62f8f866c6db18dbbb1df23b9990c154be774b76c3216b745dd57c83342",
        "tokens": 128
      },
      "status": "ok"
    },
    {
      "preset": "ram-3g",
      "plan_hash": "15e7ce1ba421c604",
      "plan": {
        "mode": "ram-ple-disk",
        "device": "llamacpp:cpu",
        "gpu_layers": 0,
        "n_ctx": 4096,
        "slots": 1,
        "kv": "f16",
        "fa": true,
        "swa_full": false,
        "mtp": true,
        "threads": 4,
        "enforcement": "strict",
        "threads_batch": 4,
        "n_batch": 2048,
        "n_ubatch": 512,
        "kv_v": "f16",
        "repack": "on",
        "load_mode": "mmap",
        "lazy": "on",
        "draft_max": 3,
        "numa": "node:0",
        "cpus": "0-3",
        "cold": true
      },
      "metrics": {
        "load_ms": 22805.99,
        "pp_tok_s": 13.50063068562769,
        "tg_tok_s": {
          "d0": 7.765424817237474
        },
        "ttft_ms": 5111.918,
        "chat_tok_s": 7.792775509650002,
        "mtp": {
          "acceptance": 0.4444444444444444,
          "speedup": 0.6595022349119566,
          "tok_s": 5.139352864781338
        },
        "peak_rss": 3440795648,
        "peak_locked": 2932736,
        "peak_page_cache": 1681244160,
        "peak_cgroup": 3422560256,
        "buffers": {
          "CPU_Mapped": 2002895427,
          "CPU_REPACK": 2656053492
        },
        "stddev": {
          "chat_tok_s": 0.3429194907153951,
          "mtp_tok_s": 0.21557876505396154,
          "pp_tok_s": 0.18639008357092868,
          "tg_tok_s.d0": 0.4306896174129668,
          "ttft_ms": 237.17629182178663
        }
      },
      "reps": 3,
      "output": {
        "sha256": "fab7a62f8f866c6db18dbbb1df23b9990c154be774b76c3216b745dd57c83342",
        "tokens": 128
      },
      "status": "ok"
    }
  ],
  "date": "2026-10-19",
  "duration_s": 1414.793400483
}
